{
  "$schema": "https://json-schema.org/draft/2020-12/schema",
  "$id": "https://solomon/specs/evaluation.schema.json",
  "title": "Solomon evaluation.json schema",
  "description": "Structured evaluator output for a single Solomon evaluation run.",
  "type": "object",
  "additionalProperties": false,
  "required": [
    "schema_version",
    "case_id",
    "session_id",
    "plugin",
    "evaluation_meta",
    "core_family_scores",
    "plugin_domain_family_scores",
    "integration_family_scores",
    "weighted_scores",
    "automatic_fail_overlays",
    "escalation_review",
    "final_judgment"
  ],
  "properties": {
    "schema_version": {
      "type": "string",
      "description": "Version of the evaluation schema."
    },
    "case_id": {
      "type": "string"
    },
    "session_id": {
      "type": "string"
    },
    "plugin": {
      "type": "string",
      "description": "Primary plugin/domain used for the case, e.g. divorce."
    },
    "benchmark_id": {
      "type": ["string", "null"],
      "description": "Benchmark scenario identifier if the case belongs to the canonical benchmark set."
    },
    "evaluation_meta": {
      "type": "object",
      "additionalProperties": false,
      "required": [
        "evaluator_id",
        "review_date",
        "policy_profile",
        "artifacts_reviewed"
      ],
      "properties": {
        "evaluator_id": {
          "type": "string"
        },
        "review_date": {
          "type": "string",
          "format": "date"
        },
        "policy_profile": {
          "type": "string",
          "enum": ["dev_verbose", "sim_minimal", "redacted", "eval_support"]
        },
        "artifacts_reviewed": {
          "type": "array",
          "items": {
            "type": "string",
            "enum": [
              "benchmark_record",
              "case_summary",
              "interaction_trace.json",
              "transcript.json",
              "summary.txt",
              "flags.json",
              "missing_info.json",
              "facts_snapshot.json",
              "positions.json",
              "case_intake_brief",
              "early_dynamics_brief",
              "risk_alert_brief",
              "continuity_packet"
            ]
          },
          "uniqueItems": true
        },
        "notes": {
          "type": "string"
        }
      }
    },
    "core_family_scores": {
      "type": "object",
      "additionalProperties": false,
      "required": [
        "C1",
        "C2",
        "C3",
        "C4",
        "C5",
        "C6",
        "C7",
        "C8",
        "C9",
        "C10"
      ],
      "properties": {
        "C1": { "$ref": "#/$defs/familyScore" },
        "C2": { "$ref": "#/$defs/familyScore" },
        "C3": { "$ref": "#/$defs/familyScore" },
        "C4": { "$ref": "#/$defs/familyScore" },
        "C5": { "$ref": "#/$defs/familyScore" },
        "C6": { "$ref": "#/$defs/familyScore" },
        "C7": { "$ref": "#/$defs/familyScore" },
        "C8": { "$ref": "#/$defs/familyScore" },
        "C9": { "$ref": "#/$defs/familyScore" },
        "C10": { "$ref": "#/$defs/familyScore" }
      }
    },
    "plugin_domain_family_scores": {
      "type": "object",
      "additionalProperties": false,
      "required": ["P1", "P2", "P3", "P4", "P5", "P6"],
      "properties": {
        "P1": { "$ref": "#/$defs/familyScore" },
        "P2": { "$ref": "#/$defs/familyScore" },
        "P3": { "$ref": "#/$defs/familyScore" },
        "P4": { "$ref": "#/$defs/familyScore" },
        "P5": { "$ref": "#/$defs/familyScore" },
        "P6": { "$ref": "#/$defs/familyScore" }
      }
    },
    "integration_family_scores": {
      "type": "object",
      "additionalProperties": false,
      "required": ["I1", "I2", "I3", "I4", "I5", "I6"],
      "properties": {
        "I1": { "$ref": "#/$defs/familyScore" },
        "I2": { "$ref": "#/$defs/familyScore" },
        "I3": { "$ref": "#/$defs/familyScore" },
        "I4": { "$ref": "#/$defs/familyScore" },
        "I5": { "$ref": "#/$defs/familyScore" },
        "I6": { "$ref": "#/$defs/familyScore" }
      }
    },
    "weighted_scores": {
      "type": "object",
      "additionalProperties": false,
      "required": [
        "core_family_weights",
        "weighted_core_family_scores",
        "core_general_score",
        "plugin_domain_family_weights",
        "weighted_plugin_domain_family_scores",
        "plugin_domain_score",
        "integration_family_weights",
        "weighted_integration_family_scores",
        "integration_score"
      ],
      "properties": {
        "core_family_weights": {
          "type": "object",
          "additionalProperties": false,
          "required": [
            "C1",
            "C2",
            "C3",
            "C4",
            "C5",
            "C6",
            "C7",
            "C8",
            "C9",
            "C10"
          ],
          "properties": {
            "C1": { "type": "number", "const": 9 },
            "C2": { "type": "number", "const": 7 },
            "C3": { "type": "number", "const": 12 },
            "C4": { "type": "number", "const": 9 },
            "C5": { "type": "number", "const": 13 },
            "C6": { "type": "number", "const": 16 },
            "C7": { "type": "number", "const": 7 },
            "C8": { "type": "number", "const": 6 },
            "C9": { "type": "number", "const": 16 },
            "C10": { "type": "number", "const": 5 }
          }
        },
        "weighted_core_family_scores": {
          "type": "object",
          "additionalProperties": false,
          "required": [
            "C1",
            "C2",
            "C3",
            "C4",
            "C5",
            "C6",
            "C7",
            "C8",
            "C9",
            "C10"
          ],
          "properties": {
            "C1": { "type": "number", "minimum": 0, "maximum": 9 },
            "C2": { "type": "number", "minimum": 0, "maximum": 7 },
            "C3": { "type": "number", "minimum": 0, "maximum": 12 },
            "C4": { "type": "number", "minimum": 0, "maximum": 9 },
            "C5": { "type": "number", "minimum": 0, "maximum": 13 },
            "C6": { "type": "number", "minimum": 0, "maximum": 16 },
            "C7": { "type": "number", "minimum": 0, "maximum": 7 },
            "C8": { "type": "number", "minimum": 0, "maximum": 6 },
            "C9": { "type": "number", "minimum": 0, "maximum": 16 },
            "C10": { "type": "number", "minimum": 0, "maximum": 5 }
          }
        },
        "core_general_score": {
          "type": "number",
          "minimum": 0,
          "maximum": 100
        },
        "core_interpretation_band": {
          "type": "string",
          "enum": [
            "strong_core_mediation_performance",
            "promising_but_materially_improvable",
            "weak_not_deployment_ready",
            "poor_core_mediation_performance"
          ]
        },
        "plugin_domain_family_weights": {
          "type": "object",
          "additionalProperties": false,
          "required": ["P1", "P2", "P3", "P4", "P5", "P6"],
          "properties": {
            "P1": { "type": "number", "const": 12 },
            "P2": { "type": "number", "const": 20 },
            "P3": { "type": "number", "const": 24 },
            "P4": { "type": "number", "const": 18 },
            "P5": { "type": "number", "const": 16 },
            "P6": { "type": "number", "const": 10 }
          }
        },
        "weighted_plugin_domain_family_scores": {
          "type": "object",
          "additionalProperties": false,
          "required": ["P1", "P2", "P3", "P4", "P5", "P6"],
          "properties": {
            "P1": { "type": "number", "minimum": 0, "maximum": 12 },
            "P2": { "type": "number", "minimum": 0, "maximum": 20 },
            "P3": { "type": "number", "minimum": 0, "maximum": 24 },
            "P4": { "type": "number", "minimum": 0, "maximum": 18 },
            "P5": { "type": "number", "minimum": 0, "maximum": 16 },
            "P6": { "type": "number", "minimum": 0, "maximum": 10 }
          }
        },
        "plugin_domain_score": {
          "type": "number",
          "minimum": 0,
          "maximum": 100
        },
        "plugin_domain_interpretation_band": {
          "type": "string",
          "enum": [
            "strong_domain_qualification",
            "useful_but_materially_improvable",
            "weak_domain_qualification",
            "unsafe_or_insufficient_domain_support"
          ]
        },
        "integration_family_weights": {
          "type": "object",
          "additionalProperties": false,
          "required": ["I1", "I2", "I3", "I4", "I5", "I6"],
          "properties": {
            "I1": { "type": "number", "const": 18 },
            "I2": { "type": "number", "const": 20 },
            "I3": { "type": "number", "const": 22 },
            "I4": { "type": "number", "const": 16 },
            "I5": { "type": "number", "const": 10 },
            "I6": { "type": "number", "const": 14 }
          }
        },
        "weighted_integration_family_scores": {
          "type": "object",
          "additionalProperties": false,
          "required": ["I1", "I2", "I3", "I4", "I5", "I6"],
          "properties": {
            "I1": { "type": "number", "minimum": 0, "maximum": 18 },
            "I2": { "type": "number", "minimum": 0, "maximum": 20 },
            "I3": { "type": "number", "minimum": 0, "maximum": 22 },
            "I4": { "type": "number", "minimum": 0, "maximum": 16 },
            "I5": { "type": "number", "minimum": 0, "maximum": 10 },
            "I6": { "type": "number", "minimum": 0, "maximum": 14 }
          }
        },
        "integration_score": {
          "type": "number",
          "minimum": 0,
          "maximum": 100
        },
        "integration_interpretation_band": {
          "type": "string",
          "enum": [
            "strong_cross_layer_coherence",
            "workable_but_materially_improvable_integration",
            "weak_integration",
            "poor_integration"
          ]
        }
      }
    },
    "automatic_fail_overlays": {
      "type": "object",
      "additionalProperties": false,
      "required": ["F1", "F2", "F3", "F4", "F5"],
      "properties": {
        "F1": { "$ref": "#/$defs/overlayStatus" },
        "F2": { "$ref": "#/$defs/overlayStatus" },
        "F3": { "$ref": "#/$defs/overlayStatus" },
        "F4": { "$ref": "#/$defs/overlayStatus" },
        "F5": { "$ref": "#/$defs/overlayStatus" }
      }
    },
    "escalation_review": {
      "type": "object",
      "additionalProperties": false,
      "required": [
        "escalation_sensitive_condition_present",
        "primary_escalation_category",
        "threshold_band",
        "observed_mode",
        "evaluator_preferred_mode"
      ],
      "properties": {
        "escalation_sensitive_condition_present": {
          "type": "boolean"
        },
        "primary_escalation_category": {
          "type": "string",
          "enum": ["E1", "E2", "E3", "E4", "E5", "E6", "none"]
        },
        "threshold_band": {
          "type": "string",
          "enum": ["T0", "T1", "T2", "T3", "T4"]
        },
        "observed_mode": {
          "type": "string",
          "enum": ["M0", "M1", "M2", "M3", "M4", "M5"]
        },
        "evaluator_preferred_mode": {
          "type": "string",
          "enum": ["M0", "M1", "M2", "M3", "M4", "M5"]
        },
        "ES1_detection_accuracy": {
          "$ref": "#/$defs/escalationScore"
        },
        "ES2_threshold_calibration": {
          "$ref": "#/$defs/escalationScore"
        },
        "ES3_mode_selection_quality": {
          "$ref": "#/$defs/escalationScore"
        },
        "ES4_rationale_quality": {
          "$ref": "#/$defs/escalationScore"
        },
        "ES5_handoff_review_quality": {
          "oneOf": [
            { "$ref": "#/$defs/escalationScore" },
            { "type": "null" }
          ]
        },
        "notes": {
          "type": "string"
        }
      }
    },
    "perception_quality_review": {
      "type": "object",
      "additionalProperties": false,
      "description": "Diagnostic assessment of how well the system perceived party state. Measures what the system saw, not what it did — intentionally distinct from C7 (emotional regulation), C9 (safety/escalation), and C6 (fair process), which measure action quality. A system can see correctly and act poorly, or act correctly on explicit triggers while missing subtler signals.",
      "required": [
        "PQ1_emotional_state_accuracy",
        "PQ2_interest_inference_quality",
        "PQ3_risk_signal_detection",
        "PQ4_relational_dynamic_awareness",
        "perception_quality_band",
        "perceived_asymmetry",
        "perception_quality_notes"
      ],
      "properties": {
        "PQ1_emotional_state_accuracy": {
          "$ref": "#/$defs/perceptionRating"
        },
        "PQ2_interest_inference_quality": {
          "$ref": "#/$defs/perceptionRating"
        },
        "PQ3_risk_signal_detection": {
          "$ref": "#/$defs/perceptionRating"
        },
        "PQ4_relational_dynamic_awareness": {
          "$ref": "#/$defs/perceptionRating"
        },
        "perception_quality_band": {
          "type": "string",
          "enum": ["strong", "competent", "developing", "weak"],
          "description": "Holistic evaluator judgment across all four PQ dimensions for this session."
        },
        "perceived_asymmetry": {
          "type": "boolean",
          "description": "True if the system demonstrably perceived one party significantly better than the other."
        },
        "perception_asymmetry_note": {
          "type": ["string", "null"],
          "description": "If perceived_asymmetry is true: which party was better perceived, what signals drove the gap, and why it matters for this case."
        },
        "perception_quality_notes": {
          "type": "string",
          "description": "Evaluator notes citing specific turns where perception was strong or failed."
        }
      }
    },
    "option_quality_review": {
      "type": "object",
      "additionalProperties": false,
      "description": "Stage 6 assessment of option generation quality. Measures the quality of the option pool produced by the brainstormer + domain reasoner stack, distinct from C5 (which measures whether options were appropriately offered). Evaluators read option_pool.json alongside the interaction trace.",
      "required": [
        "OQ1_option_diversity",
        "OQ2_interest_alignment",
        "OQ3_domain_fit",
        "OQ4_non_obvious_value",
        "OQ5_qualification_accuracy",
        "option_quality_band",
        "option_quality_notes"
      ],
      "properties": {
        "OQ1_option_diversity": {
          "$ref": "#/$defs/optionQualityRating"
        },
        "OQ2_interest_alignment": {
          "$ref": "#/$defs/optionQualityRating"
        },
        "OQ3_domain_fit": {
          "$ref": "#/$defs/optionQualityRating"
        },
        "OQ4_non_obvious_value": {
          "$ref": "#/$defs/optionQualityRating"
        },
        "OQ5_qualification_accuracy": {
          "$ref": "#/$defs/optionQualityRating"
        },
        "option_quality_band": {
          "type": "string",
          "enum": ["strong", "competent", "developing", "weak"],
          "description": "Holistic evaluator judgment across all five OQ dimensions for this session."
        },
        "option_quality_notes": {
          "type": "string",
          "description": "Evaluator notes citing specific options or qualification decisions that drove the band rating."
        }
      }
    },
    "final_judgment": {
      "type": "object",
      "additionalProperties": false,
      "required": [
        "overall_judgment",
        "evaluator_confidence",
        "short_rationale"
      ],
      "properties": {
        "overall_judgment": {
          "type": "string",
          "enum": [
            "strong",
            "promising_but_improvable",
            "weak",
            "poor"
          ]
        },
        "evaluator_confidence": {
          "type": "string",
          "enum": ["high", "medium", "low"]
        },
        "short_rationale": {
          "type": "string"
        },
        "follow_up_recommendation": {
          "type": "string"
        },
        "requires_separate_review": {
          "type": "boolean"
        },
        "requires_calibration_review": {
          "type": "boolean"
        }
      }
    },
    "artifact_links": {
      "type": "object",
      "additionalProperties": false,
      "properties": {
        "interaction_trace": { "type": "string" },
        "transcript": { "type": ["string", "null"] },
        "flags": { "type": "string" },
        "summary": { "type": "string" },
        "case_intake_brief": { "type": ["string", "null"] },
        "early_dynamics_brief": { "type": ["string", "null"] },
        "risk_alert_brief": { "type": ["string", "null"] },
        "continuity_packet": { "type": ["string", "null"] }
      }
    }
  },
  "$defs": {
    "familyScore": {
      "type": "object",
      "additionalProperties": false,
      "required": ["score"],
      "properties": {
        "score": {
          "type": "integer",
          "minimum": 1,
          "maximum": 5
        },
        "note": {
          "type": "string"
        }
      }
    },
    "overlayStatus": {
      "type": "object",
      "additionalProperties": false,
      "required": ["status"],
      "properties": {
        "status": {
          "type": "string",
          "enum": ["no", "borderline_review", "yes"]
        },
        "note": {
          "type": "string"
        }
      }
    },
    "escalationScore": {
      "type": "object",
      "additionalProperties": false,
      "required": ["score"],
      "properties": {
        "score": {
          "type": "integer",
          "minimum": 1,
          "maximum": 5
        },
        "note": {
          "type": "string"
        }
      }
    },
    "perceptionRating": {
      "type": "object",
      "additionalProperties": false,
      "description": "Named-category rating for a single PQ dimension. Uses qualitative labels for evaluator clarity rather than numeric scores.",
      "required": ["rating"],
      "properties": {
        "rating": {
          "type": "string",
          "enum": ["strong", "competent", "developing", "weak"],
          "description": "strong: reliably accurate, catches subtle signals; competent: mostly accurate, occasional misses; developing: variable, misses important signals in some turns; weak: frequently inaccurate or signals systematically missed."
        },
        "note": {
          "type": "string",
          "description": "Optional turn-level evidence supporting the rating."
        }
      }
    },
    "optionQualityRating": {
      "type": "object",
      "additionalProperties": false,
      "description": "Named-category rating for a single OQ dimension (Stage 6 option quality evaluation). Uses qualitative labels consistent with PQ dimensions.",
      "required": ["rating"],
      "properties": {
        "rating": {
          "type": "string",
          "enum": ["strong", "competent", "developing", "weak"],
          "description": "strong: exemplary performance on this dimension; competent: adequate with minor gaps; developing: partial performance with notable gaps; weak: dimension largely unmet."
        },
        "note": {
          "type": "string",
          "description": "Optional evidence from the option_pool.json or session supporting the rating."
        }
      }
    }
  }
}
